[
    {
        "groupName": "Clustering Algorithm",
        "setName": "Cluster A",
        "setColor": [255, 0, 0],
        "obsId": "cell_243"
    },
    {
        "groupName": "Clustering Algorithm",
        "setName": "Cluster A",
        "setColor": [255, 0, 0],
        "obsId": "cell_271"
    },
    {
        "groupName": "Clustering Algorithm",
        "setName": "Cluster A",
        "setColor": [255, 0, 0],
        "obsId": "cell_247"
    },
    {
        "groupName": "Clustering Algorithm",
        "setName": "Cluster A",
        "setColor": [255, 0, 0],
        "obsId": "cell_248"
    }
]